{
  "version": 2,
  "schema_ref": ".specify/templates/human-acceptance-state-schema.json",
  "status": "draft",
  "source": {
    "implementation_summary": "implementation-summary.md",
    "implementation_summary_sha256": "",
    "implementation_handoff": "implementation-handoff.json",
    "implementation_handoff_sha256": "",
    "review_state": "review-state.json",
    "review_state_sha256": "",
    "reviewed_snapshot_sha256": "",
    "acceptance_universe_sha256": "",
    "runtime_targets_sha256": "",
    "prepared_from_sha256": "",
    "current_sha256": ""
  },
  "orientation": {
    "outcome": "",
    "why_it_matters": "",
    "user_visible_changes": [],
    "not_in_scope": [],
    "prerequisites": [],
    "start_here": ""
  },
  "acceptance_universe": {
    "obligations": [],
    "uncovered_obligation_ids": [],
    "verdict": "pending"
  },
  "review_exceptions": [],
  "runtime_targets": [],
  "scenarios": [],
  "cursor": {
    "scenario_id": null,
    "step_id": null
  },
  "findings": [],
  "repair_resume": null,
  "repair_history": [],
  "overall": {
    "verdict": "pending",
    "summary": "",
    "next_command": "sp-accept (Classic) or spx-accept (Advanced)",
    "human_decision": "pending",
    "decision_confirmation_id": "",
    "decision_evidence": []
  }
}
